{
  "schemaVersion": 1,
  "kind": "practical_to_written_registration",
  "registrationId": "practical-written-001",
  "authorization": {
    "authorizedAt": "2026-10-22T11:09:39.404937+00:00",
    "scope": "p1_registration_p2_review_and_public_release",
    "practicalChangesAllowed": false
  },
  "baseline": {
    "sourceCommit": "4536277093f80273dd9f5799b32990a74d260466",
    "bankVersion": "2026.10.14-editorial.5",
    "bankSha256": "42c3eed6dea79a03f78226b1887b93c71f11f0d3fb6fa63b5ba3c298a823edf2",
    "manifestSha256": "5d16fd0e2ff104f3a57b1a8b6ff3b431599475cdb0f1589125c065f11836596f"
  },
  "status": "closed",
  "registeredAt": "2026-10-22T11:50:31.755715+00:00",
  "batches": [
    {
      "batchId": "p1-reuse",
      "origin": "p1_reused",
      "startedAt": "2026-10-21T07:02:30.820847+00:00",
      "decisionDeadline": "2026-10-21T09:02:30.820847+00:00",
      "closedAt": "2026-10-21T07:33:23.121095+00:00",
      "candidateIds": [
        "pw21-g01-w01",
        "pw21-g02-w01",
        "pw21-g03-w01",
        "pw21-g04-w01",
        "pw21-g05-w01",
        "pw21-g06-w01",
        "pw21-g07-w01",
        "pw21-g09-w01",
        "pw21-g10-w01",
        "pw21-g11-w01",
        "pw21-g12-w01",
        "pw21-g14-w01",
        "pw21-g15-w01",
        "pw21-g17-w01",
        "pw21-g18-w01",
        "pw21-g19-w01"
      ]
    },
    {
      "batchId": "p2-a",
      "origin": "p2_reviewed",
      "startedAt": "2026-10-22T11:16:00.872564+00:00",
      "decisionDeadline": "2026-10-22T14:16:00.872564+00:00",
      "closedAt": "2026-10-22T11:42:15.969394+00:00",
      "candidateIds": [
        "pw22-g08-w01",
        "pw22-g13-w01",
        "pw22-g16-w01",
        "pw22-g20-w01",
        "pw22-g21-w01",
        "pw22-g22-w01",
        "pw22-g24-w01",
        "pw22-g25-w01",
        "pw22-g26-w01"
      ]
    },
    {
      "batchId": "p2-b",
      "origin": "p2_reviewed",
      "startedAt": "2026-10-22T11:16:00.872564+00:00",
      "decisionDeadline": "2026-10-22T14:16:00.872564+00:00",
      "closedAt": "2026-10-22T11:41:50.488065+00:00",
      "candidateIds": [
        "pw22-g27-w01",
        "pw22-g28-w01",
        "pw22-g29-w01",
        "pw22-g30-w01",
        "pw22-g31-w01",
        "pw22-g32-w01",
        "pw22-g33-w01",
        "pw22-g37-w01",
        "pw22-g40-w01"
      ]
    }
  ],
  "candidates": [
    {
      "candidateId": "pw21-g01-w01",
      "groupId": "G01",
      "origin": "p1_reused",
      "subjectId": "s3",
      "questionId": "pw21-g01-w01",
      "templateId": "pw21-template-g01",
      "learningGoalId": "pw21-goal-g01",
      "authorId": "author-p1",
      "originalPracticalRefs": [
        {
          "questionId": "r005-standards-p02",
          "revision": 1,
          "sha256": "31151610578e0023b7b9e941f5941db478747a4998ea2f3d55c3567327345ef2"
        }
      ],
      "priorWrittenIds": [
        "r003-standards-s1-w06",
        "r011-dom-form-s3-w06",
        "r015-dom-html-s3-w04",
        "seed-w05"
      ],
      "cycles": [
        {
          "cycle": 1,
          "revision": 1,
          "startedAt": "2026-10-21T07:13:16.503509+00:00",
          "completedAt": "2026-10-21T07:27:23.231733+00:00",
          "outcome": "revise",
          "input": {
            "path": "docs/conversions/evidence/practical-written-001/pw21-g01-w01-cycle-1.json",
            "sha256": "4ae245db51baf940e5dcc4c21f963d09879435cb801ce8c0d4954e32bfaec554"
          },
          "originArtifacts": [
            {
              "label": "review-input",
              "sha256": "0c734f2a8c6226000496bf44b4d9e880a891a0bbe0a7dd568decc430fc084322"
            },
            {
              "label": "source-review",
              "sha256": "005779883ae48a3d6b8ad5118fb93e81ecbfa0fb7bc50c8dad295393f7d3aa4e"
            },
            {
              "label": "semantic-review",
              "sha256": "56308f2b88ef078e5df72500e2ff34efa83069f17dd3d5d06378a39a73219d91"
            },
            {
              "label": "structural-review",
              "sha256": "8b39b1221853b7573dd4a7ae81dee0c4dda01479a610e5636a8130412facf591"
            },
            {
              "label": "blind-comparison",
              "sha256": "d29be8c10919f14ae63829392e595d099562ce870f25607b08b72973cae19095"
            }
          ],
          "blind": {
            "reviewerId": "blind-p1-cycle1",
            "keyExposedBeforeSolve": false,
            "inputSha256": "14dab15dfd4b4fb6200fc7e9b899b8f3a95d27e69b1181d882657ee6322df442",
            "answerSha256": "d164e2c0ff234e5dac0328658fc8eb14b15d02ec05bcf8d84e4914f67088f19a",
            "selectedOptionId": "pw21-g01-w01-o2"
          },
          "gates": {
            "blindSolve": {
              "result": "pass",
              "reviewerId": "blind-p1-cycle1",
              "summary": "label의 for는 대상 input의 id와 일치해야 한다. 두 번째 input의 id를 office로 바꾸면 중복 id가 사라지고 자택·회사 레이블이 각각 올바른 입력란을 가리킨다."
            },
            "sourceCheck": {
              "result": "pass",
              "reviewerId": "source-p1",
              "summary": "현재 확인한 1차 규칙과 기존 확인기록의 사용 범위 안에서 정답·오답 근거가 성립한다."
            },
            "ambiguityCheck": {
              "result": "pass",
              "reviewerId": "semantic-p1",
              "summary": "for와 고유 id의 대응을 유지하면서 두 입력란을 서로 다르게 연결해야 한다. 둘째 input의 id=office 수정만 자택/homePhone과 회사/workPhone의 의도된 연결을 함께 복구한다."
            },
            "authoringAccessibility": {
              "result": "pass",
              "reviewerId": "semantic-p1",
              "summary": "다섯 수정안이 한 속성의 변경/추가라는 같은 관점이다. 정답만 장황하거나 특별한 예외를 덧붙이지 않는다. 입력 순서와 name 정보가 두 전화 입력란의 정체성을 고정한다."
            },
            "structuralCheck": {
              "result": "pass",
              "reviewerId": "structural-p1",
              "summary": "원 구조 검사에서 schema3·ID·4/5지선다·엄격 해설 저작을 확인했다. 실제 앱·화면낭독기 검사는 포함하지 않는다."
            }
          }
        },
        {
          "cycle": 2,
          "revision": 2,
          "startedAt": "2026-10-21T07:27:23.231733+00:00",
          "completedAt": "2026-10-21T07:33:23.121095+00:00",
          "outcome": "accepted",
          "input": {
            "path": "docs/conversions/evidence/practical-written-001/pw21-g01-w01-cycle-2.json",
            "sha256": "ea02e1b44a32a6d5f599aad4b24172d14f2d59ff73729443024994469c652a6e"
          },
          "originArtifacts": [
            {
              "label": "review-input",
              "sha256": "9299a736a4f168b8a89642e16161c76e85b4d2392100b64c8b8405883be80ff1"
            },
            {
              "label": "source-review",
              "sha256": "4f30852e5d4e27ef5561d55f946a4e7c18b612bdb417c6425510ec28a99dcafc"
            },
            {
              "label": "semantic-review",
              "sha256": "0c0684b0d736a7c4b5ddfe9e6a967d1aebcc2b7e1e39fa564f669f362a4cd7a5"
            },
            {
              "label": "structural-review",
              "sha256": "825b76bb651decc5732861b48ae9ad62b23b3e897bd176b4702e797232e5a16d"
            },
            {
              "label": "blind-comparison",
              "sha256": "92cc713be2bcf36dbd2b06d35f5032e165b231eba6a8b2822c6cd13308676664"
            }
          ],
          "blind": {
            "reviewerId": "blind-p1-cycle2",
            "keyExposedBeforeSolve": false,
            "inputSha256": "07878fb2ce8faeb8a88d6eccf6adcd1569988a3993dd054c2e3f0610e4cb8c7a",
            "answerSha256": "f705c406785b61339191ee49d43b6e248f98a0b44cf95e35a32ff2f76f4cea36",
            "selectedOptionId": "pw21-g01-w01-o2"
          },
          "gates": {
            "blindSolve": {
              "result": "pass",
              "reviewerId": "blind-p1-cycle2",
              "summary": "label의 for는 대응 input의 id와 연결된다. 회사 전화 입력란의 id를 office로 바꾸면 자택은 home, 회사는 office로 각각 연결되고 중복 id도 없어진다."
            },
            "sourceCheck": {
              "result": "pass",
              "reviewerId": "source-p1",
              "summary": "HTML id·title 출처가 추가되었고 고정판 표기가 정확해졌다. 지문·선택지는 동일하다."
            },
            "ambiguityCheck": {
              "result": "pass",
              "reviewerId": "semantic-p1",
              "summary": "명시적 label-for와 고유 id의 대응에서 둘째 input id만 office로 바꾸면 두 입력란의 의도된 연결이 모두 복구된다. name 변경·title 추가·for 통합·첫째 id 변경은 각각 연결 실패 또는 입력란 교환을 남긴다."
            },
            "authoringAccessibility": {
              "result": "pass",
              "reviewerId": "semantic-p1",
              "summary": "본문·보기·다섯 선택지의 의미는 그대로이며 추가 sourceRefs/지정판 표기가 질문 해석을 바꾸지 않는다. 각 선택지는 단일 속성 변경/추가로 평행하고 정답 길이 단서가 없다."
            },
            "structuralCheck": {
              "result": "pass",
              "reviewerId": "structural-p1",
              "summary": "원 구조 검사에서 schema3·ID·4/5지선다·엄격 해설 저작을 확인했다. 실제 앱·화면낭독기 검사는 포함하지 않는다."
            }
          }
        }
      ],
      "decision": "accepted",
      "reason": "원 검토의 정확한 문항·연결 선택지·최종 출처 확인을 재사용한다. 후보 검토 횟수와 원 실패 기록을 유지하며 등록 상태만 전환한다."
    },
    {
      "candidateId": "pw21-g02-w01",
      "groupId": "G02",
      "origin": "p1_reused",
      "subjectId": "s3",
      "questionId": "pw21-g02-w01",
      "templateId": "pw21-template-g02",
      "learningGoalId": "pw21-goal-g02",
      "authorId": "author-p1",
      "originalPracticalRefs": [
        {
          "questionId": "seed-p02",
          "revision": 4,
          "sha256": "2a0621e083e571b2074e7454c7f60c8132261f62348428d64bd6a6800e64483e"
        }
      ],
      "priorWrittenIds": [
        "r002-internet-html-w19",
        "seed-w06"
      ],
      "cycles": [
        {
          "cycle": 1,
          "revision": 1,
          "startedAt": "2026-10-21T07:13:16.503509+00:00",
          "completedAt": "2026-10-21T07:33:23.121095+00:00",
          "outcome": "accepted",
          "input": {
            "path": "docs/conversions/evidence/practical-written-001/pw21-g02-w01-cycle-1.json",
            "sha256": "f782d5c4411e88b28770e47310e70f778261f28260f4948261e2de0a7902ad4f"
          },
          "originArtifacts": [
            {